title,author,url,publication_date,content,issue,filename
Russian troops retreated from the north and the outskirts of Kyiv by April 2022, after encountering stiff resistance and logistical challenges. The Bucha massacre was uncovered after their withdrawal. In the southeast, Russia launched an offensive in the Donbas and captured Mariupol after a destructive siege. Russia continued to bomb military and civilian targets far from the front, and struck the energy grid during winter months. In late 2022, Ukraine launched successful counteroffensives in the south and east, liberating most of Kharkiv Oblast. Soon after, Russia illegally annexed four partly-occupied provinces. In November, Ukraine liberated Kherson. In June 2023, Ukraine launched another counteroffensive in the southeast but made few gains. After small but steady Russian advances in the east in the first half of 2024, Ukraine launched a cross-border offensive into Russia’s Kursk Oblast in August, where North Korean soldiers were sent to assist Russia. The United Nations Human Rights Office reports that Russia is committing severe human rights violations in occupied Ukraine. The direct cost of the war for Russia has been over US \$450 billion.\[23]\[24]\[25]

The invasion was met with widespread international condemnation. The United Nations General Assembly passed a resolution condemning the invasion and demanding a full Russian withdrawal. The International Court of Justice ordered Russia to halt military operations, and the Council of Europe expelled Russia. Many countries imposed sanctions on Russia and its ally Belarus and provided large-scale humanitarian and military aid to Ukraine. The Baltic states and Poland declared Russia a terrorist state. Protests occurred around the world, with anti-war protesters in Russia being met by mass arrests and greater media censorship. The Russian attacks on civilians have led to allegations of genocide.\[26]\[27]\[28]\[29] War-related disruption to Ukrainian agriculture and shipping contributed to a world food crisis; war-related local environmental damage has been described as ecocide and the war has heavily disrupted global climate policy. The International Criminal Court (ICC) opened an investigation into crimes against humanity, war crimes, abduction of Ukrainian children, and genocide against Ukrainians. The ICC issued arrest warrants for Putin and five other Russian officials.

**Background**

*Further information: Russia–Ukraine relations*

**Post-Soviet relations**

After the dissolution of the Soviet Union in 1991, Russia and Ukraine maintained cordial relations. In return for security guarantees, Ukraine signed the Nuclear Non-Proliferation Treaty in 1994 and gave up the nuclear weapons it inherited from the Soviet Union.\[30] Russia, the US, and UK thus agreed in the Budapest Memorandum to uphold Ukraine’s sovereignty and territorial integrity.\[31] In 1999, Russia signed the Charter for European Security, affirming the right of each state “to choose or change its security arrangements” and to join alliances.\[32] In 2002, Putin said Ukraine’s relations with NATO were “a matter for those two partners”.\[33] In 2005, Putin said that if Ukraine wanted to join NATO, “we will respect their choice, because it is their sovereign right to decide their own defence policy, and this will not worsen relations between our countries”.\[34]

Russia invaded Georgia in 2008 and took control of Abkhazia and South Ossetia, demonstrating Russia’s willingness to use force to attain its political objectives.\[35] The US “was accused of appeasement and naivete” over its reaction to the invasion.\[36]

**Ukrainian revolution**

*Main article: Revolution of Dignity*

Protesters at a rally on Independence Square, 19 January 2014

In 2013, Ukraine’s parliament approved finalising the European Union–Ukraine Association Agreement.\[37] Russia raised concerns about the agreement when it became clear Ukraine would no longer be able to maintain the same level of relations with Russia.\[38] Russia put pressure on Ukraine to reject the agreement and imposed economic sanctions on the country.\[39] Kremlin adviser Sergei Glazyev warned in September 2013 that if Ukraine signed the EU agreement, Russia would no longer acknowledge Ukraine’s borders.\[40]

In November, Ukrainian president Viktor Yanukovych suddenly withdrew from signing the agreement,\[41] choosing closer ties to the Russian-led Eurasian Economic Union instead. This coerced withdrawal triggered protests known as Euromaidan, culminating in the Revolution of Dignity in February 2014. Almost 100 protesters were killed by state forces. Despite signing an agreement, Yanukovych fled. Parliament voted to remove him.

**Russian invasion in Crimea and Donbas**

Ukraine, with the annexed Crimea in the south and two Russia-backed separatist republics in Donbas in the east up to the 2022 invasion

On 27 February 2014, Russian soldiers with no insignia began to invade the Ukrainian territory of Crimea,\[42] and fully controlled the peninsula by late March.\[43] At first, Russia denied the soldiers were theirs, but Putin later admitted they were Russian special forces.\[44] Russia annexed Crimea in March, after a widely condemned and disputed referendum held under occupation. Historians liken the annexation to Nazi Germany’s Anschluss of Austria.\[45]\[46]

Pro-Russian protests followed in the Ukrainian cities of Donetsk and Luhansk. Separatists proclaimed the Donetsk People’s Republic (DPR) and Luhansk People’s Republic (LPR). The War in Donbas began in April 2014 when armed Russian paramilitaries led by Igor ‘Strelkov’ Girkin seized Sloviansk and other settlements, and the Ukrainian military began an operation against them.\[47]\[48]\[49] Russia covertly supported the separatists with troops, tanks and artillery.\[50] The International Criminal Court judged that the war was a national and international armed conflict involving Russia,\[51] and the European Court of Human Rights judged that Russia controlled the DPR and LPR from 2014 onward.\[52] Ukraine’s parliament declared the Donbas region to be occupied by Russia.\[53]

The annexation of Crimea and Donbas war sparked a wave of Russian nationalism. Analyst Vladimir Socor called Putin’s 2014 speech following the annexation a “manifesto of Greater-Russia irredentism”.\[54] Putin began referring to “Novorossiya” (New Russia), a former Russian imperial territory that covered much of southern Ukraine.\[55] Russian-backed forces were influenced by Russian neo-imperialism\[56] and sought to create a new Novorossiya.\[57] Putin cited the Kosovo independence precedent and NATO bombing of Yugoslavia as a justification for military intervention.\[58]\[59]\[60]\[61]

The Normandy Format meeting in December 2019 would be the first and only meeting between Zelenskyy and Putin.\[62]

When the conflict began in 2014, Ukraine was officially a neutral country\[63] and said it was not seeking NATO membership.\[64]\[65] Because of Russia’s occupation of Crimea and its invasion of the Donbas, Ukraine’s parliament voted in December 2014 to revoke the country’s neutral status and seek membership of NATO.\[66]\[67]

The Minsk agreements, signed in September 2014 and February 2015, aimed to resolve the conflict, but ceasefires and further negotiations failed.\[68] The West’s weak response to Russia’s attack led Russia to believe the West would not react strongly to the 2022 invasion.\[69]\[70]\[71] Several political scientists said this encouraged further Russian aggression.\[72]\[73]\[74]

**Economic aspects**

Economic interests were also a motive for Russia’s attack on Ukraine and its annexation of the southeast. Control of lithium deposits in the Donbas and Ukraine’s grain wealth would give Russia a “monopoly on the world market”.\[75] In 2022, Russian General Vladimir Ovchinsky confirmed that the “Russian special operation” aimed to seize Ukrainian lithium deposits.\[23]\[76]

The US government estimates that Russia’s economic losses from the war and Western sanctions will amount to around US \$1.3 trillion by 2025, and Russia’s direct financial spending on the invasion is estimated at US \$250 billion (as of late 2024) – costs that Russia could not have foreseen. According to a study published in mid-2022 by Canadian think tank SecDev, Russia seized energy reserves, metals and minerals worth at least US \$12.4 trillion in the Donbas, including 41 coal fields (63 percent of Ukraine’s coal reserves), 27 natural gas fields, 9 oil fields, 6 iron ore deposits, two titanium ore deposits, a strontium deposit, a uranium deposit, a gold deposit and a large limestone quarry. The total value of raw material stocks in Ukraine is estimated at over US \$26 trillion.\[23] The value of lithium and rare earths in Ukraine is estimated at US \$11.5 trillion.\[76] In January 2024, the Russian occupation government in Donetsk Oblast granted the Russian Ministry of Natural Resources permission to mine lithium in the Shevchenko deposit near Kurakhovo, which is estimated to be worth hundreds of billions of US dollars.\[23]

The Russian elite, especially Russian generals, had invested assets and property in Ukraine for money laundering purposes before the invasion.\[75]

**Prelude**

*Main articles: Prelude to the Russian invasion of Ukraine, Ukraine–NATO relations § Russian opposition to Ukrainian NATO membership, and Disinformation in the Russian invasion of Ukraine*

Russian military build-up around Ukraine as of 3 December 2021

There was Russian military build-up near Ukraine’s borders in March and April 2021,\[77] and again in both Russia and Belarus from October 2021 onward.\[78] Russia said it was only holding military exercises. Members of its government, including Putin, repeatedly denied having plans to invade Ukraine, issuing denials up until the day before the invasion.\[79]\[80]\[81]

While Russian troops massed on Ukraine’s borders, Russia’s proxy forces launched thousands of attacks on Ukrainian troops in the Donbas.\[82] Observers from the Organization for Security and Co-operation in Europe (OSCE), which includes Ukraine and Russia, reported more than 90,000 ceasefire violations throughout 2021; most in Russian-controlled territory.\[83]

In July 2021, Putin published an essay “On the Historical Unity of Russians and Ukrainians”, in which he called Ukraine “historically Russian lands” and claimed there is “no historical basis” for the “idea of Ukrainian people as a nation separate from the Russians”.\[84]\[85] Putin claimed Ukraine never had “real statehood” and the creation of modern Ukraine was a mistake.\[86] Putin was accused of promoting Russian imperialism,\[87] historical revisionism and disinformation.\[88]\[89]

Meeting of the NATO-Russia Council on 12 January 2022

The December 2021 Russian ultimatum to NATO included demands that NATO end activity in its Eastern European member states and ban Ukraine or any former Soviet state from ever joining the alliance.\[18]\[90]\[91] Russia’s government said NATO was a threat and warned of a military response if it followed an “aggressive line”.\[92] Some demands had already been ruled out by NATO. A US official said the US was willing to discuss the proposals, but there were some “the Russians know are unacceptable”.\[90] Eastern European states willingly joined NATO for security reasons, and the last time a country bordering Russia had joined was in 2004. Ukraine had not yet applied, and some members were wary of letting it join.\[93] Barring Ukraine would go against NATO’s “open door” policy, and against treaties agreed to by Russia.\[94] NATO Secretary General Jens Stoltenberg replied that “Russia has no say” on whether Ukraine joins, and “no right to establish a sphere of influence to try to control their neighbours”.\[95] NATO underlined that it is a defensive alliance, and it had co-operated with Russia until the latter annexed Crimea.\[94] It offered to improve communication with Russia, and negotiate limits on missile placements and military exercises, as long as Russia withdrew troops from Ukraine’s borders,\[96] but Russia did not.

Western leaders vowed heavy sanctions would be imposed should Putin invade rather than negotiate.\[97] French President Emmanuel Macron\[98] and German Chancellor Olaf Scholz met Putin in February 2022 to dissuade him from an invasion. Putin told him that Ukraine should not be an independent state.\[99] Scholz told Ukrainian President Zelenskyy to declare Ukraine a neutral country and renounce its aspirations to join NATO. Zelenskyy replied that Putin could not be trusted, as he had broken agreements.\[100] Ukraine had been a neutral country in 2014 when Russia occupied Crimea and invaded the Donbas.\[63]\[101] On 19 February, Zelenskyy made a speech at the Munich Security Conference, calling for Western powers to end their “appeasement” towards Putin and give a clear time-frame for when Ukraine could join NATO.\[102] Analysts Taras Kuzio and Vladimir Socor agree that “when Russia made its decision to invade Ukraine, that country was more remote than ever not only from NATO membership but from any track that might lead to membership”.\[91]

Luhansk power station after being shelled by Russian-backed forces in the Donbas, 22 February 2022

Shortly before the invasion, Russia’s proxy forces stepped up attacks on Ukrainian forces and civilians in the Donbas.\[103]\[104] Separatist leaders warned that Ukraine was about to launch an offensive, but they gave no evidence, and The Guardian noted it would be “exceedingly risky” for Ukraine to assault the Donbas while Russian troops were massed on its borders.\[104] Ukraine and Western leaders accused Russia of staging false flag attacks and trying to provoke retaliation, to give Russia a pretext for invading.\[103]\[104] On 17 February, Russian proxy forces shelled a kindergarten in Ukrainian-held territory, then blamed it on Ukraine.\[104] Zelenskyy said his military would not respond to the provocations.\[103]

**Invasion plans**

The Royal United Services Institute reported that Russia’s plan involved defeating Ukraine within ten days and capturing or killing its government, followed by “mopping up” operations; establishing filtration camps for Ukrainians; setting up occupation regimes; executing people involved in the Revolution of Dignity; and lastly annexation.\[105]\[106]\[107] The decision to invade was reportedly made by Putin and a small group of war hawks or siloviki in Putin’s inner circle, including national security adviser Nikolai Patrushev and defence minister Sergei Shoigu.\[108]

**Putin’s invasion announcement**

*Main article: On conducting a special military operation*

Putin’s address to the nation on 24 February 2022. Minutes after Putin’s announcement, the invasion began.

On 21 February, Putin announced that Russia recognised the Donetsk People’s Republic and Luhansk People’s Republic as independent states. The following day, Russia announced that it was sending troops into the territories as “peacekeepers”,\[109] and the Federation Council of Russia authorised the use of military force abroad.\[110]

Before 5 a.m. Kyiv time on 24 February, Putin, in another speech, announced a “special military operation”, which effectively declared war on Ukraine.\[111]\[112] Putin said the operation was to “protect the people” of the Russian-controlled breakaway republics. He baselessly claimed that Russians in the Donbas had “been facing humiliation and genocide perpetrated by the Kyiv regime” for 8 years.\[20] Putin said Russia was being threatened: he baselessly claimed that Ukrainian officials were neo-Nazis under Western control, that Ukraine was developing nuclear weapons, and a hostile NATO was building up its forces and infrastructure in Ukraine.\[113]\[114] He said Russia sought the “demilitarisation and denazification” of Ukraine, and denied the legitimacy of the Ukrainian state.\[114]\[86] Putin said he had no plans to occupy Ukraine.\[113] The invasion began within minutes of Putin’s speech.\[111]

**Events**

For a chronological guide, see Timeline of the Russian invasion of Ukraine.
For a more comprehensive list, see List of military engagements during the Russian invasion of Ukraine.

Ukrainian regions annexed by Russia since 2014 (Autonomous Republic of Crimea and Sevastopol) and 2022 (others). The 2022 annexation created a strategic land bridge between Crimea and Russia.

The invasion began at dawn on 24 February.\[111]\[115] It was the biggest attack on a European country and first full-scale war in Europe since World War II.\[116] Russia launched a simultaneous ground and air attack.\[117]\[118] Missiles struck targets throughout Ukraine,\[119] and Russian troops invaded from the north, east, and south.\[120] Russia did not officially declare war.\[121] Immediately after the invasion began, Zelenskyy declared martial law in Ukraine in a video speech.\[122] The same evening, he ordered a general mobilisation of all Ukrainian males aged 18–60,\[123] prohibiting them from leaving the country.\[124]

*Remnants of a destroyed Russian column on 27 February in Bucha*

The first stage of the invasion was conducted on four fronts: one towards western Kyiv from Belarus by the Russian Eastern Military District, one deployed towards eastern Kyiv by the Central Military District (northeastern front), comprised the 41st Combined Arms Army and the 2nd Guards Combined Arms Army,\[125] one deployed towards Kharkiv, and a fourth, southern front originating in Crimea and Russia’s Rostov oblast with an eastern axis towards Odesa and a western area of operations toward Mariupol.\[125] The invasion was unexpectedly met by fierce resistance.\[126] In Kyiv, Russia failed to take it and was repulsed in the battles of Irpin, Hostomel, and Bucha. The Russians tried to encircle the capital, but defenders under Oleksandr Syrskyi held their ground, effectively using Western Javelin anti-tank missiles and Stinger anti-aircraft missiles to thin Russian supply lines and stall the offensive.\[127]

By 7 April, Russian troops deployed to the northern front pulled back from Kyiv, to resupply and redeploy to the Donbas to reinforce the renewed invasion of southeastern Ukraine. The northeastern front, including the Central Military District, was similarly withdrawn for redeployment to southeastern Ukraine.\[125]\[128] On 26 April, delegates from the US and 40 allied nations met at Ramstein Air Base in Germany to discuss a coalition to provide economic support, in addition to military supplies and refitting to Ukraine.\[129] Following Putin’s Victory Day speech on 9 May, US Director of National Intelligence Avril Haines said no short term resolution should be expected.\[130]

Ukraine’s reliance on Western-supplied equipment constrained operational effectiveness, as supplying countries feared Ukraine would use Western-made matériel to strike targets in Russia.\[131] Experts disagreed on the future of the conflict; some suggested Ukraine should trade territory for peace,\[132] others believed Ukraine could maintain its resistance due to Russian losses.\[133]

**Initial invasion (24 February – 7 April 2022)**

For a chronological guide, see Timeline of the Russian invasion of Ukraine (24 February – 7 April 2022).

*Animated map of the Russian invasion from 24 February to 7 April 2022*

The invasion began on 24 February, launched out of Belarus to target Kyiv, and from the northeast against the city of Kharkiv. The southeastern front was conducted as two separate spearheads, from Crimea and the southeast against Luhansk and Donetsk.

***Kyiv and northern front***

*Further information: Capture of Chernobyl; Battle of Kyiv (2022); Bucha massacre; Siege of Chernihiv; Battle of Sumy; Russian occupation of Sumy Oblast*

The Antonov An-225 Mriya, the largest aircraft ever built, was destroyed during the Battle of Antonov Airport.

Russian tried to seize Kyiv quickly with a probative spearhead on 24 February, from Belarus south along the west bank of the Dnipro River, with Spetsnaz infiltrating into the city supported by airborne operations and a rapid mechanised advance from the north, but failed.\[134]\[135] The apparent intent was to encircle the city from the west, supported by two separate axes of attack along the east bank of the Dnipro: the western at Chernihiv, and from the east at Sumy.\[117]\[118] Russian forces advanced into Chernihiv Oblast on 24 February, besieging its administrative capital within four days of fighting.\[136]\[137] Travelling along highways, Russian forces reached Brovary, an eastern suburb of Kyiv, on 4 March.\[118]\[117]

The US contacted Zelenskyy and offered to help him flee, lest the Russian Army attempt to kidnap or kill him on seizing Kyiv; Zelenskyy responded that “The fight is here; I need ammunition, not a ride.”\[138] By early March, Russian advances along the west side of the Dnipro were limited by Ukrainian defences.\[118]\[117] As of 5 March, a Russian convoy, reportedly 64 kilometres (40 mi) long, had made little progress toward Kyiv.\[139] Advances from Chernihiv largely halted as a siege began there. Russian forces advanced on Kyiv from the northwest, capturing Bucha, Hostomel and Vorzel by 5 March.\[140]\[141]\[142] By 11 March, the lengthy convoy had largely dispersed and taken cover.\[143] On 16 March, Ukrainian forces began a counter-offensive.\[144] Unable to achieve a quick victory in Kyiv, Russian forces switched to indiscriminate bombing and siege warfare.\[145]\[146]

On 25 March, a Ukrainian counter-offensive retook towns to the east and west of Kyiv.\[147]\[148] Russian troops in the Bucha area retreated north. Ukrainian forces entered the city on 1 April, and recaptured the region around Kyiv, and uncovered evidence of war crimes in Bucha.\[149]\[150] The Pentagon confirmed on 6 April that the Russian army had left Chernihiv Oblast;\[151] local authorities said Russian troops had left Sumy Oblast.\[152] NATO secretary-general Jens Stoltenberg said the Russian “retraction, resupply, and redeployment” of troops from the Kyiv area should be interpreted as an expansion of Putin’s plans for concentrating his forces on eastern Ukraine.\[128]

***Southern and eastern front***

*Further information: Siege of Mariupol; Odesa strikes (2022–present); Battle of Kherson; Battle of Enerhodar; Battle of Kharkiv (2022); Battle of Izium; Millerovo air base attack; Russian occupation of Kherson Oblast; Russian occupation of Zaporizhzhia Oblast; Russian occupation of Kharkiv Oblast*

Russian bombardment on the outskirts of Kharkiv, 1 March 2022

On 24 February, Russian attack groups moved northwest from Crimea, capturing bridges over the Dnieper\[153] and the North Crimean Canal.\[154] On 1 March, Kherson was the first major city to fall to Russia.\[155] Russian troops moved on Mykolaiv and attacked it, but were repelled.\[156] Russian forces approached the Zaporizhzhia Nuclear Power Plant\[157] and besieged Enerhodar. By 25 February, Russian units had begun advancing on Mariupol.\[158] Russian forces captured Berdiansk.\[159]\[160]\[161] On 1 March, Denis Pushilin, head of the DPR, announced that it had surrounded Volnovakha.\[162]

By 18 March, Mariupol was completely encircled and fighting had reached the city centre, hampering efforts to evacuate civilians.\[163] The Russians demanded surrender, and the Ukrainians refused.\[164] On 27 March, Ukrainian deputy prime minister Olha Stefanishyna said that “(m)ore than 85 percent of the whole town is destroyed.”\[165] Russia refused safe passage into Mariupol to 50 buses sent by the UN to evacuate civilians.\[166]\[167]

In the east, Russian troops attempted to capture Kharkiv,\[168] and met strong Ukrainian resistance. Izium was captured by Russian forces on 1 April\[169] after a monthlong battle.\[170] On 25 March, the Russian defence ministry said it would seek to occupy major cities in eastern Ukraine.\[171]

On 3 April, following the retreat of Russian forces from Kyiv, Russia expanded its attack on southern Ukraine, with bombardment and strikes against Odesa, Mykolaiv, and the Zaporizhzhia Nuclear Power Plant.\[172]\[173] By 7 April, the renewed massing of Russian troops and tanks around Izium, Sloviansk, and Kramatorsk prompted Ukrainian officials to advise remaining residents near the eastern border to evacuate to western Ukraine.\[174]

**Southeastern front (8 April – 5 September 2022)**

For a chronological guide, see Timeline of the Russian invasion of Ukraine (8 April – 28 August 2022).

*Animated map of the Russian invasion from 7 April to 5 September 2022*

By 17 April, Russian progress on the southeastern front appeared impeded by Ukrainian forces in the large, heavily fortified Azovstal Iron and Steel Works and surrounding area in Mariupol.\[175] On 19 April Russia launched an “eastern assault” across a 480-kilometre (300 mi) front extending from Kharkiv to Donetsk and Luhansk, with simultaneous missile attacks again directed at Kyiv and Lviv.\[176] An anonymous US Defence official called the Russian offensive “very tepid”, “minimal at best”, and “anaemic”.\[177]

