title,author,url,publication_date,content,issue,filename
Australia kills off carbon tax,Lenore Taylor,https://www.theguardian.com/environment/2014/jul/17/australia-kills-off-carbon-tax,Wed 16 Jul 2014 21.51 EDT,"Australia’s carbon price has been repealed, leaving the nation with no legislated policy to achieve even the minimum 5% greenhouse emissions reduction target it has inscribed in international agreements.

After eight years of bitter political debate, during which climate policy dominated three election campaigns and contributed to the demise of two prime ministers, after last week’s Senate drama in which the repeal was again defeated and this week’s lengthy last gasp debate, the Senate has now finally voted to make good Tony Abbott’s “pledge in blood” to “axe the tax”.

The government was backed by seven of the new crossbench senators, including the three Palmer United party senators, Liberal Democrat senator David Leyonhjelm, Family First senator Bob Day, Motoring Enthusiast senator Ricky Muir, DLP senator John Madigan. Independent senator Nick Xenophon was unwell.

Only the Australian Labor party and the Greens voted against repealing the carbon pricing scheme they introduced, which came into effect two years ago.

Leader of the government in the Senate and former climate change minister Penny Wong said repealing the bills meant “this nation will have walked away from a credible and efficient response to climate change”.

Wong said the prime minister Tony Abbott had “staked his political career … on fearmongering and scaremongering and that is what this debate has been about for years”.

“I think future generations will look back on these bills and they will be appalled … at the short-sighted, opportunistic selfish politics of those opposite and Mr Abbott will go down as one of the most short-sighted, selfish and small people ever to occupy the office of prime minister.”

Government backbencher Ian Macdonald accused opposition parties of being hypocrites for refusing to accept the will of the voters and said that while he had “an open mind”, he would like to point out that Brisbane had recently had its coldest day in 113 years.

Greens leader Christine Milne said it was “a vote for failure” amid interjections from government backbenchers that she should “get over it” because the parliament was “respecting the will of the Australian people.”

How the Senate voted

The bills passed 39:32. There was none of the jubilation that accompanied their passage in the lower house, but the leader of the government in the Senate, Eric Abetz, shook hands with backbench senator Cory Bernardi, who led the revolt against Malcolm Turnbull when, as leader of the opposition, he backed Labor’s carbon pricing scheme.

The tax was $25.40 a tonne and was scheduled to move to the floating and lower international price in 12 months.

The repeal will cost the budget around $7bn over the next four years as around 350 businesses, mainly electricity generators and big manufacturers, no longer have to pay the tax.

The government argues the carbon pricing scheme has been ineffective, but national emissions have actually fallen by 0.8% in the first calendar year of its operation, the largest fall in 24 years of records. Since the tax began, emissions from the east coast electricity market have fallen 11%, but emissions from other sources – especially coal and gas mining have increased.

The government also says households will be better off by an average $550 – the amount treasury estimated prices would rise when the tax was introduced – but supermarkets and airlines are now saying consumers should not expect price reductions.

The Australian Competition and Consumer Commission’s special powers are to monitor and enforce only electricity and gas price reductions. Electricity bills will rise, but by an estimated 9% less than they otherwise would. Gas bills will rise by an estimated 7% less than they would have with the tax still in place.

The Abbott government says it will now achieve the target of a 5% reduction in Australian emissions compared with 2000 levels by 2020 with its Direct Action policy, which will offer $2.5bn in competitive grants over the next four years to companies and organisations voluntarily reducing emissions. The budget actually allocated only $1.14bn over the four-year forward estimates for the scheme. The government said this is because they will pay on delivery of the abatement. The policy is voluntary and puts no overall cap on emissions.

The government itself has not modelled Direct Action (Abbott said he would prefer to “have a crack”), but two other modelling exercises found even the 5% cut would cost far more than $2.5bn, and the independent climate change authority – which the government is seeking to abolish – has said Australia’s “fair share” of international emissions reductions has now increased to between 15% and 19% by 2020.

The government says it is sure Direct Action will meet the 5% target, but Abbott has said he will not allocate any more money even if it does not, and has not said how he would make deeper reductions in Australia’s emissions which are likely to be required after the United Nations meeting to try to forge a new post-2020 climate agreement in Paris next year.

Malcolm Turnbull warned of the long-term costs of the policy in a speech to parliament after he was deposed as leader because of his support for an emissions trading scheme, when he said Direct Action style schemes were “a recipe for fiscal recklessness on a grand scale”.

The carbon price repeal bills were voted down in the Senate last week after a last-minute change to a Palmer United party amendment was ruled to be unconstitutional by the clerk of the Senate. The government had been prepared to accept the amendment but then changed it again over the weekend after business groups raised major concerns.

Business groups welcomed the repeal as a “first step” towards achieving an effective emissions reduction policy.

The Business Council of Australia, the Minerals Council of Australia and the Australian Industry Group called on the government to “develop and implement a cost-effective emissions reduction fund” as “part of a toolkit of measures to reduce emissions”.

But the Climate Institute thinktank said that “by repealing laws that price and limit carbon pollution, Australia today became the world’s first country to dismantle a functioning and effective carbon market, taking a monumentally reckless backward leap even as other major countries are stepping up climate action”.

And the Australian Conservation Foundation said: “This backwards step makes Australia an international embarrassment.”

Describing it as a “tragic day”, Greens leader senator Christine Milne said after the vote that “the big polluters should pay for the destruction they are causing to the planet”. She accused the Coalition of “wanting to cost-shift the burden of climate change onto the community and away from the people who are causing it”.

Both Labor and the Greens say they remain committed to carbon pricing as the best way to reduce emissions.

Speaking after the vote, agriculture minister Barnaby Joyce said the tax had imposed high costs on families, and questioned whether it was needed, saying “look at the weather today, look at the way you are dressed, no one thinks it is too hot”.

“I believe there is climate change happening, I just don’t believe we are going to change it with a broad-based consumption tax.”

“I am glad the carbon tax has been axed … we have Direct Action and there are programs that hopefully can assist … but the idea that somehow we inflict on every household the fact that we would attack their power prices to the Australian taxation offices. They took it to the Australian people and the Australian people rejected it,” Joyce said.",australia-carbon-tax,guardian.txt
Carbon Pricing in Australia,Wikipedia Contributors,https://en.wikipedia.org/wiki/Carbon_pricing_in_Australia,Unknown,"Financial year    Carbon Price\* (\$/tonne)
2012–13             23.00
2013–14             24.15
1 July 2014 onwards    revoked
Source: Clean Energy Regulator \[1]

* per tonne of emitted CO₂

A carbon pricing scheme in Australia was introduced by the Gillard Labor minority government in 2011 as the Clean Energy Act 2011 which came into effect on 1 July 2012. Emissions from companies subject to the scheme dropped 7 % upon its introduction \[2]. As a result of being in place for such a short time, and because the then Opposition leader Tony Abbott indicated he intended to repeal “the carbon tax”, regulated organizations responded rather weakly, with very few investments in emissions reductions being made \[3]. The scheme was repealed on 17 July 2014, backdated to 1 July 2014. In its place the Abbott government set up the Emission Reduction Fund in December 2014. Emissions thereafter resumed their growth evident before the tax \[4].

The carbon price was part of a broad energy reform package called the Clean Energy Futures Plan, which aimed to reduce greenhouse gas emissions in Australia by 5 % below 2000 levels by 2020 and 80 % below 2000 levels by 2050. Although Australia does not levy a direct carbon price \[5], the plan set out to achieve these targets by encouraging Australia’s largest emitters to increase energy efficiency and invest in sustainable energy. The scheme was administered by the Clean Energy Regulator. Compensation to industry and households was funded by the revenue derived from the charge. The scheme required entities which emit over 25,000 tonnes of carbon dioxide equivalent greenhouse gases per year, and which were not in the transport or agriculture sectors, to obtain emissions permits, called carbon units. Carbon units were either purchased from the government or issued free as part of industry assistance measures. As part of the scheme, personal income tax was reduced for those earning less than A\$80,000 per year and the tax-free threshold was increased from A\$6,000 to A\$18,200 \[6]. Initially the price of a permit for one tonne of carbon was fixed at A\$23 for the 2012–13 financial year, with unlimited permits being available from the government. The fixed price rose to A\$24.15 for 2013–14.

The government had announced that the scheme was part of a transition to an emissions trading scheme in 2014–15, where the available permits will be limited in line with a pollution cap. The scheme primarily applied to electricity generators and industrial sectors. It did not apply to road transport and agriculture. The Department of Climate Change and Energy Efficiency stated that in June 2013 only 260 entities were subject to the scheme \[7], of which approximately 185 were liable to pay for carbon units. Domestic aviation did not face the carbon price scheme, but was subject to an additional fuel excise levy of approximately 6 cents per liter.

In February 2012, the Sydney Morning Herald reported that Clean Energy Future carbon price scheme had not deterred new investment in the coal industry, as spending on exploration had increased by 62 % in 2010–2011, more than any other mineral commodity. The government agency Geoscience Australia reported that investment in coal prospecting reached \$520 million in 2010–2011 \[8]. Falls in carbon emissions were observed following implementation of this policy \[9]. It was noted that emissions from sectors subject to the pricing mechanism were 1.0 % lower \[10] and nine months after the introduction of the pricing scheme, Australia’s carbon dioxide emissions from electricity generation had fallen to a 10-year low, with coal generation down 11 % from 2008 to 2009 \[11]. However, attribution of these trends to carbon pricing have been disputed, with Frontier Economics claiming trends are largely explained by factors unrelated to the carbon tax \[12]\[13]. Electricity demand had been falling and in 2012 was at the lowest level seen since 2006 in the National Electricity Market \[14].

Australia’s Greenhouse Gas Emissions    Mt CO₂ equiv
Sector               Year 2012
Energy – Electricity      190.8
Stationary energy excluding electricity 94.2
Transport            91.5
Fugitive emissions       42.3
Industrial processes       32.3
Agriculture           88.0
Waste             12.8
Total              551.9
Excludes land use, land use change and forestry
Source – Australia’s National Greenhouse Inventory Dec 2012

## History

Economy-wide pricing of carbon is the centre piece of any policy designed to reduce emissions at the lowest possible costs.
— Ross Garnaut \[15]

In 2003, the Howard Government was close to creating an emissions trading scheme, but business lobbying caused the government to stop considering it in September of that year \[16]. In October 2006 the Stern Review on the effect of climate change on the world’s economy was released for the British government. This report recommended a range of measures including ecotaxes to address the market failure represented by climate change with the least amount of economic and social disruption. In response to this report and subsequent pressure from the Kim Beazley led Labor opposition, in December 2006 the Howard government established the Prime Ministerial Task Group on Emissions Trading, chaired by Peter Shergold, to advise on the implementation of an emissions trading scheme (ETS) in Australia \[17]\[18]. In opposition, Kevin Rudd called for a cut to greenhouse gas emissions by 60 % before 2050 \[19]. Both the incumbent Howard government and the Rudd Labor opposition promised to implement an emissions trading scheme (ETS) before the 2007 federal election. Following the release of the final Shergold report, the Howard government committed to introduce an ETS in June 2007 \[20]\[21].

Going into the 2007 federal election, the Labor opposition party presented itself as a “pro-climate” alternative to the Government, with Kevin Rudd, who had by then deposed Beazley as leader, famously describing climate change as “the great moral challenge of our generation”. Labor differentiated itself from the government by promising an ETS with an earlier start date of 2010 rather than the 2012 timeframe advocated by Howard. It also promised ratification of the Kyoto Protocol, investment in clean coal and renewable energy, and slightly more aggressive targets for renewable energy \[17].

Labor won the election on 24 November 2007, and on 3 December 2007 the Rudd government signed the ratification of the Kyoto Protocol at the 2007 United Nations Climate Change Conference. By ratifying the Kyoto Protocol, Australia committed to keeping emissions to no more than 108 % of its 1990 emissions level by 2012. Australia’s ratification came into effect on 11 March 2008 \[22].

The Rudd government began negotiating the passage of an ETS through the Parliament. The Opposition led by Brendan Nelson called for the vote on the government’s ETS be delayed until after the United Nations climate change summit in Copenhagen in December 2009. Prime Minister Rudd said in response that it would be “an act of absolute political cowardice, an absolute failure of leadership not to act on climate change until other nations had done so” and the government pursued the early introduction of the Scheme \[23].

On 16 July 2008, the Rudd government released a green paper for its Carbon Pollution Reduction Scheme (CPRS) (also known as Australia’s ETS), outlining the intended design of the scheme. The CPRS was criticised by those who were both for and against action to mitigate climate change. Environmental lobby groups protested that the emissions reductions targets were too low, and that the level of assistance to polluters was too high. Industry and business lobby groups however argued for more permits and assistance to offset the economic impacts of the scheme on many enterprises, particularly during the 2008 financial crisis \[17]. Malcolm Turnbull became the new Liberal Opposition Leader on 18 September 2008. On 30 September 2008, the Garnaut Climate Change Review, commissioned in April 2007 by Rudd when he was leader of the Opposition, released its final report. Garnaut recommended a price between \$20 and \$30 per tonne of carbon dioxide (CO₂) equivalent with a rise of 4 % each year \[15]. A more detailed white paper on the CPRS was released on 15 December 2008 \[24].

Unable to secure the support of the crossbench for their preferred model, the government entered negotiations with Turnbull, and in the lead up to the Copenhagen Conference, presented an amended CPRS scheme, with the support of Turnbull. The Turnbull-led Opposition supported the CPRS scheme in principle, although at times over 2009 they indicated disagreement with various details including the timing of implementation of the scheme, timing of the vote on the relevant legislation and on the level of assistance to be provided to polluting industries. The Opposition was able to negotiate greater compensation for polluters affected by the scheme in November 2009 \[17]\[25].

Shortly before the Senate was due to vote on the carbon bills, on 1 December 2009 Tony Abbott replaced Turnbull as leader of the Liberal Party \[26]. Abbott immediately called a secret ballot on support for the ETS among coalition MPs, which was overwhelmingly rejected \[27]. The Coalition then withdrew their support for the carbon pricing policy and joined the Greens and Independents in voting against the relevant legislation in the Parliament of Australia on 2 December 2009 \[28]. As the Rudd government required the support of either the Coalition or the Greens to secure passage of the bill, it was defeated in the Senate. Abbott described Labor’s ETS plan as a ‘Great big tax on everything’.

Abbott announced a new Coalition policy on carbon emission reduction in February 2010, which committed the Coalition to a 5 % reduction in emissions by 2020. Abbott proposed the creation of an ‘emissions reduction fund’ to provide ‘direct’ incentives to industry and farmers to reduce carbon emissions \[29]. In April 2010, Rudd deferred attempts to advance the scheme to at least 2013 \[30], opting not to present the legislation to the Senate a second time, creating a trigger for a double dissolution election. In June 2010, Julia Gillard replaced Rudd as leader of the Labor Party and became prime minister. Factional leader and key Gillard supporter Bill Shorten said that the sudden announcement of change of policy on the ETS was a factor that had contributed to a collapse in support for Rudd’s leadership \[31].

Shortly afterwards Gillard called a federal election for 21 August 2010. During the election campaign Gillard stated that she supported a price on carbon emissions and that she would prosecute the case for action for as long as she needed to win community support \[32]. However, she also indicated that she would not introduce carbon pricing until there was a sufficient consensus on the issue \[33], that any carbon price legislated would not come into effect until after the 2013 election \[34], and she specifically ruled out the introduction of a “carbon tax” \[32].

The result of the election left Australia with its first hung parliament in 70 years. To form a majority in the House of Representatives both of the major parties needed to acquire the support of cross-benchers, including the Greens. After two weeks of negotiations Gillard had enough support to gain a majority including the support of the Greens and their single MP in the House, Adam Bandt. Gillard, therefore, remained prime minister and Abbott remained in Opposition. One of the conditions for Greens support was that the formation of a cross-party parliamentary committee to determine policy on climate change. Gillard honoured that agreement and on 27 September 2010 the Multi-Party Climate Change Committee (MPCCC) was formed, its terms of reference including that it was to report to Cabinet on ways to introduce a carbon price \[35]\[36]. The MPCCC agreed on the introduction of a fixed carbon price commencing 1 July 2012, transitioning to a flexible-price cap-and-trade ETS on 1 July 2015 \[37]. Initially the price of permits is fixed and the quantity unlimited i.e. there is no cap; the scheme thus functions similarly, and is popularly referred to as a tax.

In February 2011, the government proposed the Clean Energy Bill \[38], which the opposition claimed to be a broken election promise \[39]. The Liberal Party vowed to overturn the bill if it was elected \[40].

The Gillard government had asked the Productivity Commission to report on the steps taken by eight major economies to address climate change. In June 2011, the report found that more than 1,000 climate policies were already enacted across the globe \[41]\[42]. It also supported a market-based carbon price as being the most cost-effective way to reduce emissions \[42]. The report’s findings were one of the major reasons that support for the carbon tax was provided by independent Tony Windsor \[42]. Windsor made it clear that he would not support the clean energy legislation if it included a carbon tax on transport fuels \[43]. He did not want to penalise people who lived in rural areas, where there was no public transport as an alternative to private vehicles.

The Clean Energy Plan was released on 10 July 2011 \[28]. The Clean Energy Bill 2011 passed the Australian House of Representatives in October 2011 and the Australian Senate in November 2011 and was thus brought into law \[44]\[45].

On 1 July 2012 the Australian Federal government introduced a carbon price scheme. To offset the impact of the tax on some sectors of society, the government reduced income tax (by increasing the tax-free threshold) and increased pensions and welfare payments slightly to cover expected price increases, as well as introducing compensation for some affected industries. On 17 July 2014, a report by the Australian National University estimated that the Australian scheme had cut carbon emissions by as much as 17 million tonnes, the biggest annual reduction in greenhouse gas emissions in 24 years of records in 2013 as the carbon tax helped drive a large drop in pollution from the electricity sector \[46].

On 17 July 2014, the Abbott government passed repeal legislation through the Senate to abolish the carbon pricing scheme \[47]. In its place the government set up the Emission Reduction Fund \[48], paid by taxpayers from consolidated revenue, which according to RepuTex, a markets consultancy, estimated the government’s main climate policy may only meet a third of the emissions reduction challenge if Australia is to cut by 5 % of 2000 levels by 2020 \[49].

## Scope and covered emissions

The carbon price came into effect on 1 July 2012 and applied to direct emissions from a facility (scope-1 emissions), but not to indirect emissions (scope-2 emissions). The scheme only applied to facilities which emit more than 25,000 tonnes CO₂-e per year, and did not apply to agriculture or to transport fuels. The carbon price was set at AUD \$23 per tonne of emitted CO₂-e on selected fossil fuels consumed by major industrial emitters and government bodies such as councils.

Agricultural emissions were exempt due to difficulty in tracking emissions and the related complexity of administering such a scheme \[50]. Households and business use of light vehicles did not incur a carbon price. However, changes to the fuel tax regime were proposed to effectively impose a carbon tax on business liquid and gaseous fuel emissions. There were plans for heavy on-road vehicles to pay from 1 July 2014 \[51].

In effect, the scope of the scheme meant that only a small number of large electricity generators and larger industrial plants were subject to the carbon price scheme. The tax was payable by surrendering carbon units, which had been either purchased (at \$20 per tonne in 2012–13) or acquired free under an industry assistance program. The pricing mechanism was expected to cover 60 % of Australia’s carbon emissions \[1]. 75 % of each company’s annual obligation were to be paid by 15 June each year with the remaining 25 % by the following 1 February.

A list of companies which had paid the carbon tax, and the amount which each had paid, was published by the Clean Energy Regulator (CER) \[52]\[53]. This was called the Liable Entities Public Information Database or LEPID. The LEPID for 2012–13 was updated on 12 July 2013 and the companies which were the fifteen largest payers of carbon tax in 2012–13 are shown in the summary below (related companies are grouped together where identifiable).

Australian’s Top 15 Payers of Carbon Tax in 2012–13
(account for 70 % of total carbon units lodged)

Company     Activity      Carbon units lodged in 2012–13 (million)
GDF Suez     Electricity generation         25.8
AGL          Electricity generation          19.1
Macquarie Generation Electricity generation         16.0
Delta Electricity    Electricity generation          13.3
Energy Australia   Electricity generation          11.9
Origin Energy   Electricity generation          11.6
Stanwell Corporation Electricity generation         11.0
CS Energy        Industrial processes          7.4
Woodside Energy    LNG production           6.6
Verve Energy        Electricity generation          5.5
NRG Gladstone   Electricity generation          4.8
BlueScope Steel    Iron & steelmaking         4.7
Alcoa           Alumina refining           4.6
Alinta Energy     Electricity generation          4.6
Millmerran     Electricity generation          4.4
Source – LEPID 12 July 2013

## Industry assistance programs

