title,author,url,publication_date,content,issue,filename
Investor optimism about Tesla has been based on the assumption that Musk’s proximity to power would lead to a national policy on autonomous vehicles that would ease the arrival of Tesla’s robotaxi, which is supposed to hit the roads of Austin, Texas, this month. Musk could also lose leverage on other issues important to Tesla, such as Trump’s tariffs on China’s critical minerals. Meanwhile, his space company SpaceX has billions of dollars of federal defense and space contracts — now at risk — while its satellite subsidiary Starlink is angling for billions more in federal broadband subsidies.

‘Attack mode’

Tesla is still the country’s largest electric automaker. But the Trump-Musk split comes at a vulnerable moment for both Tesla and electric vehicles writ large.

The company is facing declining sales around the world, as its vehicle lineup has grown stale and Musk’s political activities have turned off many EV buyers in Europe and North America.

Meanwhile, federal support for EVs is hanging by a thread. The House’s version of the megabill would drastically scale back Biden-era tax incentives meant to stimulate EV manufacturing and sales.

The fight between Trump and Musk escalated on Thursday after Trump told reporters that Musk was “upset” about the House-passed bill’s proposal to remove EV tax credits and other incentives. Musk took to X to deny that narrative, writing: “Keep the EV/solar incentives cuts in the bill, also cut all the crazy spending increases in the Big Ugly Bill so that America doesn’t go bankrupt!”

The president’s repeated attacks on EVs and vows to repeal the Biden administration’s subsidies certainly didn’t seem to trouble Musk much during last year’s campaign, when the megabillionaire spent more than $270 million and countless hours to help put Trump back into the White House. (Trump did concede at the time that Tesla made a “great product.”)

Musk’s apparent willingness to sacrifice federal incentives was unwelcome news to clean energy and EV advocates who hope Republican senators will save some of the tax credits from the Democrats’ 2022 climate law. Republicans can afford to lose only three votes in the Senate, and some GOP senators have indicated they think the bill’s rollbacks go too far.

The war of words between Trump and Musk ended any hopes that the Tesla CEO would have the leverage with the White House to tip the scales.

“Elon was ‘wearing thin,’ I asked him to leave, I took away his EV Mandate that forced everyone to buy Electric Cars that nobody else wanted (that he knew for months I was going to do!), and he just went CRAZY!” Trump posted on his social media site, Truth Social.

That statement was a far cry from three months ago, when Trump made a show of buying a Tesla in front of the White House. That gesture raised hopes among some Tesla shareholders that Republicans would embrace Tesla and compensate for its diminished popularity among Democrats, many of whom had taken to staging protests outside its showrooms.

“I’m going to buy because No. 1, it’s a great product, as good as it gets. And No. 2, because this man has devoted his energy and his life to doing this, I think he’s been treated very unfairly by a very small group of people,” Trump said at the time about Musk.

Now, that’s all changed.

“Trump no longer has to say nice things about Tesla and EVs,” said Loren McDonald, an analyst at the EV data shop Paren, in a message. “He and the admin can go back to ‘EVs are evil’ attack mode.”

Critical minerals and beyond

The fizzled bromance could also alter the myriad and complex relationships that Tesla has across the globe, as well as its business before the federal government.

Musk, for example, will presumably hold no sway over the administration’s intended move to impose steep tariffs on imports of Chinese graphite used to make EV batteries.

The Commerce Department concluded last month that imported Chinese graphite is receiving unfair subsidies. The agency laid out a plan to impose tariffs of up to 721 percent on some natural and artificial graphite active anode material from China that’s used in batteries.

Tesla has fought against the tariffs, with one of the company’s attorneys pointing out that U.S. manufacturers don’t yet produce anode material that meets carmakers’ standards.

The fallout could also put a bulls-eye on Musk’s financial ties to Beijing, something Democrats have repeatedly railed against.

The Trump administration and lawmakers from both parties are pushing to ease China’s grip on supply chains, from the production of critical minerals to processing and manufacturing of EV batteries.

Yet Tesla has many ties to China, including reliance on graphite imports, a gigafactory located in Shanghai, and ongoing work with Contemporary Amperex Technology Ltd. CATL, the world’s largest battery-maker, is on a U.S. government list of companies that work with the Chinese military.

In short, nothing on Thursday boded well for America’s leading electric automaker.

“It’s another Twilight Zone moment in this Musk/Trump relationship which now is quickly moving downhill,” wrote Dan Ives, an analyst at investment shop Wedbush Securities who tracks Tesla.

But Ives nonetheless remained hopeful. The subject line of his email: “Friends Again Soon?”

Hannah Northey contributed to this report.",musk-trump-feud,politico.txt
From bros to foes: how the unlikely Trump-Musk relationship imploded,Nandita Bose and Jeff Mason,https://www.reuters.com/world/us/bros-foes-how-unlikely-trump-musk-relationship-imploded-2025-06-06/,"June 6, 2025","When Donald Trump met privately with White House officials on Wednesday, there was little to suggest that the U.S. president was close to a public break with Elon Musk, the billionaire businessman who helped him win a second term in office. Two White House officials familiar with the matter said Trump expressed confusion and frustration in the meeting about Musk's attacks on his sweeping tax and spending bill. But he held back, the officials said, because he wanted to preserve Musk's political and financial support ahead of the 2026 midterm election. 

By Thursday afternoon, Trump's mood had shifted. He had not spoken to Musk since the attacks began and was fuming over what one White House aide described as a ""completely batshit"" tirade by the Tesla CEO on X, his social media platform. On Friday, a White House official said Trump was not interested in talking to Musk and no phone call between the two men was planned for the day. Musk had blasted Trump's tax bill as fiscally reckless and a ""disgusting abomination."" He vowed to oppose any Republican lawmaker who supported it. The bill would fulfill many of Trump's priorities while adding, according to the Congressional Budget Office, $2.4 trillion to the $36.2-trillion U.S. public debt.

Privately, Trump had called Musk volatile. On Thursday, he told his team, it was time to take the gloves off. Sitting next to German Chancellor Friedrich Merz in the Oval Office, Trump told reporters he was ""very disappointed"" in his former adviser. Musk quickly hit back on social media, and the back-and-forth devolved from there. ""The easiest way to save money in our budget, billions and billions of dollars, is to terminate Elon's government subsidies and contracts,"" Trump posted on Truth Social, his social media site. Within minutes, Musk said it might be time to create a new political party and endorsed a post on X from Ian Miles Cheong, a prominent Musk supporter and right-wing activist, calling for Trump's impeachment.

The depth of the Trump-Musk relationship at its height was unprecedented in Washington - a sitting president granting a billionaire tech CEO access and influence inside the White House and throughout his government. Musk spent nearly $300 million backing Trump's campaign and other Republicans last year. For months, Musk played both insider and disruptor - shaping policy conversations behind the scenes, amplifying Trump's agenda to millions online, and attacking the bureaucracy and federal spending through his self-styled Department of Government Efficiency. Just last week, Trump hosted a farewell for Musk and declared that ""Elon is really not leaving."" Now he had not only left but had turned into a top critic. Hours after Trump's Oval Office remarks, a third White House official expressed surprise at Musk's turnaround. It ""caught the president and the entire West Wing off guard,"" she said. Musk did not respond to emails seeking comment about the downturn in relations. His super PAC spending group, America PAC, and spokeswoman Katie Miller did not respond to calls and texts requesting comment.

In a statement, the White House called the breakup an ""unfortunate episode from Elon, who is unhappy with the One Big Beautiful Bill because it does not include the policies he wanted."" The Musk-Trump breakup sent Tesla's stock price plunging 14% on Thursday and drove uncertainty among Trump's allies in Congress, who are working to pass the monumental spending package that Democrats and a small number of vocal Republicans oppose. Tesla shares clawed back from steep losses on Friday. 

The breakup could reshape both men's futures. For Trump, losing Musk's backing threatens his growing influence among tech donors, social media audiences, and younger male voters — key groups that may now be harder to reach. It could also complicate fundraising ahead of next year's midterm elections. For Musk, the stakes are potentially even higher. The break risks intensified scrutiny of his business practices that could jeopardize government contracts and invite regulatory probes, which might threaten his companies' profits. Some of Musk's friends and associates were stunned by the fallout, with a number of them only recently expressing confidence that the partnership would endure, according to two other sources familiar with the dynamics. The split had been simmering for weeks, said the first two White House officials, but the breaking point was over personnel: Trump's decision to pull his nomination of Jared Isaacman, Musk's hand-picked candidate to be NASA administrator. ""He was not happy"" about Isaacman, one of the White House officials said of Musk.

Isaacman, a billionaire entrepreneur and close Musk ally, was seen as key to advancing Musk's vision for space exploration and commercial space ventures. After his nomination was scuttled, Isaacman posted on X: ""I am incredibly grateful to President Trump, the Senate and all those who supported me."" The move was viewed within the administration as a direct snub to Musk, the two officials said, signaling a loss of political clout and deepening the rift between him and Trump's team. Before the Isaacman episode, top White House aides behind the scenes had already begun limiting Musk's influence — quietly walking back his authority over staffing and budget decisions. Trump himself reinforced that message in early March, telling his cabinet that department secretaries, not Musk, had the final say over agency operations. At the same time, Musk began to hint that his time in government would come to a close, while expressing frustration at times that he could not more aggressively cut spending. 

His threats and complaints about Trump's bill grew louder, but inside the White House, few believed they would seriously alter the course of the legislation — even as some worried about the fallout on the midterms from Musk's warnings to cut political spending, the first two White House officials said. Still, a fourth White House official dismissed the impact of Musk's words on the president's signature bill. ""We're very confident,"" he said. ""No one has changed their minds."" But there was bafflement at the White House at how a relationship that only last week had been celebrated in the Oval Office had taken such a turn. Time will tell whether the rift can be repaired.",musk-trump-feud,reuters.txt
Trump and Musk Split,Spencer Neale,https://www.theamericanconservative.com/trump-and-musk-split/,"Jun 5, 2025","The relationship between President Donald Trump and Tesla CEO Elon Musk collapsed in spectacular fashion on Thursday. 

As Trump met with the Chancellor of Germany Friedrich Merz at the White House Thursday afternoon, Musk posted a battery of tweets to his social media platform X criticizing Trump’s “Big Beautiful” spending bill.

“The Big Ugly Bill will INCREASE the deficit to $2.5 trillion!” warned Musk. 

“In the entire history of civilization, there has never been legislation that both big and beautiful,” read another missive. “Either you get a big and ugly bill or a slim and beautiful bill. Slim and beautiful is the way.”

Musk also reshared years-old tweets from Trump in an effort to highlight the president’s alleged hypocrisy.  

“I cannot believe the Republicans are extending the debt ceiling—I am a Republican & I am embarrassed!” Trump wrote in January of 2013. Those words are at odds with Trump’s most recent position on the debt ceiling. The 47th president said on Wednesday that he was “very pleased to announce” that he agrees with longtime Democratic rival Sen. Elizabeth Warren, who has called for the debt ceiling to be scrapped. “Wise words,” Musk replied sarcastically to Trump’s 2013 post.

Musk escalated his rhetoric as Trump finished his meeting with Merz. Musk said Trump was guilty of “ingratitude” and suggested the 47th president could not have won the 2024 election without his financial assistance. “Dems would control the House and the Republicans would be 51-49 in the Senate,” wrote Musk. The DOGE man then created a poll which asked X users if he should form “a new political party in America that actually represents the 80% in the middle?” The poll received more than 3 million votes by Thursday evening with more than 80% of respondents voting in support of Musk’s idea. 

Responding on Truth Social, Trump said he “asked Musk to leave” his administration because the tech titan was “wearing thin.” Trump added, “I took away his EV mandate that forced everyone to buy Electric Cars that nobody else wanted… and he just went CRAZY!” 

The president wasn’t finished. In a separate post to Truth, Trump threatened Musk’s business by suggesting the “easiest way to save money on the Budget” is “to terminate Elon’s Governmental Subsidies and Contracts.”

The stock price of Tesla collapsed following the threat, finishing almost 15 percent down on the day and erasing more than $150 billion in market cap from the carmaker, marking the company’s biggest daily loss in history. It was amid the Tesla sell off that Musk fired off what he called “the really big bomb,” accusing Trump of being “in the Epstein files.”

“That is the real reason they have not been made public,” Musk stated. “Have a nice day, DJT!” Adding fuel to the fire, Musk later suggested that Trump be impeached and that Vice President J.D. Vance be made president instead. 

In retaliation to the series of tweets, Trump ally Steve Bannon called Musk an “illegal” and said the South African tech magnate should be deported from the United States “immediately.”

Writing on Truth Social late Thursday evening, Trump seemed to lower the temperature. 

“I don’t mind Elon turning against me, but he should have done so months ago,” Trump wrote. “This is one of the Greatest Bills ever presented to Congress. It’s a Record Cut in Expenses, $1.6 Trillion Dollars, and the Biggest Tax Cut ever given. If this Bill doesn’t pass, there will be a 68% Tax Increase, and things far worse than that. I didn’t create this mess, I’m just here to FIX IT.”",musk-trump-feud,american-conservative.txt
Excitement as Two New Pandas Arrive in US from China,Brendan Smialowski / AFP,https://www.aljazeera.com/news/2024/10/15/excitement-as-two-new-pandas-arrive-in-us-from-china,15 Oct 2024,"China has sent two giant panda bears to the United States to be housed in Washington, DC’s Smithsonian National Zoo, in a rare diplomatic overture between the two countries.

The three-year-old pandas – a male named Bao Li and a female named Qing Bao – arrived at Virginia’s Dulles International Airport, which serves the US capital, on Tuesday.

They are among a small handful of the black-and-white bears still in the US, which sent most of the highly sought animals back to their native China in recent years under pre-arranged contracts. That includes the return last November of the only three pandas living in Washington’s National Zoo.

Many viewed the absence of a quick replacement for the three pandas as reflective of growing US-China friction, but Chinese President Xi Jinping soon promised he would send new pandas as “envoys of friendship”.

In August, the San Diego Zoo welcomed two new giant pandas, the first to arrive in the US in 21 years.

Anticipation over the arrival of the two new pandas in Washington, DC, has been high, with the zoo’s website featuring a banner that reads: “The pandas are coming”.

“The giant pandas are an iconic part of the Washington, DC story, both for locals and incoming travellers alike,” said Elliott L Ferguson, II, president and CEO of Destination DC. “The interest and excitement associated with their return directly benefits the entire city, bringing further interest and visitors to our hotels, restaurants and other attractions.”

The National Zoo has been renovating its panda habitat ahead of the new bears’ arrival, setting up new shallow pools and bamboo stands.

The pandas will not be available to the public for more than a month as they quarantine and acclimate to their new habitat.

China has been using so-called “panda diplomacy” since 1972, when the first animals were sent to Washington as a gift, following US President Richard Nixon’s historic visit to China.

Later, a rolling series of 10-year cooperation agreements was struck, which Chinese Embassy spokesperson Liu Pengyu credited with advancing research in panda preservation.

“The current round of cooperation will focus on prevention and treatment of major diseases, and protection of habitats and wild giant panda populations,” Liu told the Associated Press via email. “We hope the arrival of the pandas will inject fresh impetus into exchanges between China and the US, and help to stabilise the broader bilateral relationship as well.”

As of 2014, there were around 1,860 giant pandas in the wild, a 17 percent increase from the decade before, according to the World Wildlife Fund (WWF). In 2021, Chinese conservationists reclassified the animal from an endangered species to one that is vulnerable.

Source: Al Jazeera and news agencies",panda-diplomacy,aljazeera.txt
Panda diplomacy,Wikipedia contributors,https://en.wikipedia.org/wiki/Panda_diplomacy,Accessed October 2023,"Panda diplomacy (Chinese: 熊猫外交) is the practice of sending giant pandas from China to other countries as a tool of diplomacy and wildlife conservation.\[1] From 1941 to 1984, the Chinese government gifted pandas to other countries. Since 1984, they have been leased rather than gifted due to a PRC policy change.

History

Pre-1950s
While there are few ancient records of the giant panda, ""During the Manchu dynasty skins of this animal \[bei-shung, presumed to be the panda] were sent as tribute to the government of China by the aborigines of western Szechuan and eastern Tibet"", according to David Crockett Graham.\[2]: 25 \[3]: 19 

Madam Chiang and John Tee-Van of the Bronx Zoo, USA, with the baby Panda in Madam Chiang's yard in Chongqing, November 9, 1941.
The first instance of panda diplomacy in the modern era was arranged by Soong Mei-ling (Madame Chiang) in 1941. China was under siege by Japan, the U.S. had been sending aid to the Kuomintang (Nationalist Government) in China, and Madame Chiang wanted a dramatic way of saying thank you. There had been previous pandas sent to the U.S., including one named Su Lin sold to the Brookfield Zoo in Chicago by Ruth Harkness in 1937, a second one named Mei-Mei brought back by Harkness in 1938 and also sold to the Brookfield Zoo,\[4] one named Pandora sent to the Bronx Zoo by David Crockett Graham in 1938, and a second named Pan sent to the Bronx Zoo in 1939.\[2]: 92  Besides the two live Pandas sent to the Bronx Zoo, Graham had also collected several skins and skeletons that were sent to the Smithsonian.\[5]: 55 

In the summer of 1941, Madame Chiang enlisted David Crockett Graham to capture a live panda. Eventually, two were caught. After spending some time at Graham's house in Chengdu, they were brought to Chongqing for a formal handover to a representative of the Bronx Zoo. William J. Dunn, a CBS radio reporter, was in Chongqing at the time and was enlisted to emcee the ceremony, which would air on both radio XGOY \[zh], ""The Voice of China,"" and CBS Radio. To ensure the program aired during prime time in the U.S., it originated from Chongquing at 4 a.m. local time.\[6]: 59–60  Annalee Whitmore, then working as publicity manager for United China Relief, interviewed the participants and wrote the transcript.\[7]: 198–200  The broadcast was to include Madame Chiang, her sister Soong Ai-ling (Madame Kung), David Crockett Graham, and John Tee-Van from the Bronx Zoo. The plan was to transmit the XGOY signal to an RCA communications centre in Manila and then on to San Francisco; however, on the morning of November 9, 1941, the engineers were unable to confirm reception from Manila. The broadcast began as planned, but atmospheric conditions prevented the broadcast from reaching the United States.\[6]: 60 

The pandas were flown to Hong Kong under cover of night and from there to the Philippines on Pan Am's Hong Kong Clipper. From there, they took a circuitous six-week route by ship to San Francisco. Unfortunately, while they were en route, Pearl Harbor was bombed;\[2]: 95–97  and, when they arrived in San Francisco in late December 1941, front-page news was all about war. While the pandas did get attention, they weren't at the top of the news across the nation as had been hoped.\[8] The bears were officially received by the Bronx Zoo on December 30, 1941, and five months later, following a national contest, they were named Pan-dee and Pan-dah.\[9]

Post-1950s
While the Republic of China used giant pandas for diplomatic means as early as 1941,\[10] The People's Republic of China began to use panda diplomacy more prominently in the 1950s and has continued the practice into the present day. Between 1957 and 1983, 24 pandas were given as gifts to 9 nations as gestures of friendship. These nations included the Soviet Union, the Democratic People's Republic of Korea, the United States of America, and the United Kingdom.\[11]

U.S. First Lady Pat Nixon viewing the Beijing Zoo panda exhibit in February 1972
When President Nixon visited China in 1972, Mao Zedong promised to send two pandas to an American zoo. In exchange, Nixon gave two musk oxen to the Chinese as a gift. The mutual gifts illustrated the growing diplomatic relationship between China and the United States at the time.\[12] Despite the long history of panda diplomacy, the arrival of the pandas in 1972 marked the first time a panda had been in the United States in over twenty years.\[11]

Upon the pandas' arrival in April 1972, First Lady Pat Nixon donated them to the National Zoo in Washington, D.C., where she welcomed them in an official ceremony. Over 20,000 people visited the pandas the first day they were on display, and an estimated 1.1 million visitors came to see them the first year they were in the United States.\[13] The pandas were wildly popular and China's gift was seen as an enormous diplomatic success, evidence of China's eagerness to establish official relations with the U.S.\[14] It was so successful that British Prime Minister Edward Heath asked for pandas for the United Kingdom during a visit to China in 1974. Pandas Chia-Chia and Ching-Ching arrived at the London Zoo a few weeks later.\[13] The pandas gifted to the UK would later be the inspiration for the logo of the World Wildlife Fund.\[11]

Mexico
One of the gifted pandas at Chapultepec Zoo, 24 July 1978
Mexico and the PRC established formal relations on 14 February 1972.\[15] On 10 September 1975,\[16] two pandas, Pe Pe (male) and Ying Ying (female), were gifted to Mexico as a sign of friendship by Mao Zedong following the April 1973 state visit to China by President Luis Echeverría. The pandas were delivered by Vicepremier of the State Council Chen Yonggui and received by First Lady María Esther Zuno.\[15] They were housed at Chapultepec Zoo. The zoo became the first institution outside China to successfully breed pandas.

In 1984, China shifted from panda gifts to a policy of high-priced loans. However, Mexico has retained ownership of the locally born pandas since their lineage traces to the gifted panda couple.\[citation needed]

In 1980, Pe Pe and Ying Ying had Xen Li, the first panda born outside China, however, she did not survive into adulthood. In 1983 the couple had Liang Liang. In 1985 Ying Ying gave birth to twins, an unnamed cub and Xiu Hua. In 1987, Ying Ying gave birth to another set of twins, Ping Ping and Shuan Shuan. In 1981 Ying Ying gave birth to Tohui, who in turn mothered Xin Xin (with Chia Chia, a gifted panda at the London Zoo). Xin Xin is the last living panda not owned by China.\[17]

Post-1984
