title,author,url,publication_date,content,issue,filename
According to the UN High Commission for Refugees as of May 2022, there were 3,315,711 refugees in Poland, 901,696 in Romania, 594,664 in Hungary, 461,742 in Moldova, 415,402 in Slovakia, and 27,308 in Belarus, while Russia reported it had received over 800,104 refugees.\[608] By July 2022, over 390,000 Ukrainian refugees had arrived in the Czech Republic, where the average refugee was a woman accompanied by a child. These refugees were twice as likely to have a college degree as the Czech population as a whole.\[616] Turkey registered more than 58,000 Ukrainian refugees as of March 2022.\[617] The EU invoked the Temporary Protection Directive for the first time, granting Ukrainian refugees the right to live and work in the EU for up to three years.\[618] Britain has accepted 146,379 refugees, as well as extending the ability to remain in the UK for three years with broadly similar entitlements as the EU, three years residency and access to state welfare and services.\[619]

According to the Organization for Security and Co-operation in Europe (OSCE), Russia has engaged in “massive deportation” of over 1.3 million Ukrainian civilians, potentially constituting crimes against humanity.\[620] The OSCE and Ukraine have accused Russia of forcibly moving civilians to filtration camps in Russian-held territory, and then into Russia. Ukrainian sources have compared this policy to Soviet-era population transfers and Russian actions in the Chechen War of Independence.\[621] For instance, as of April 2022, Russia claimed to have evacuated about 121,000 Mariupol residents to Russia.\[621]\[622] RIA Novosti and Ukrainian officials said that thousands were dispatched to centres in cities in Russia and Russian-occupied Ukraine,\[623] from which people were sent to economically depressed regions of Russia.\[624]\[625]\[j]

**Long-term demographic effects**

Ukrainian refugees entering Romania, 5 March 2022

Both Russia and Ukraine faced the prospect of significant population decline even before the war, having among the lowest fertility rates worldwide and considerable emigration. It is the first time that two countries with an average age above 40 have gone to war against each other.\[627] Russia had a fighting-age (18-to-40-year-old) male population more than four times higher than Ukraine’s and slightly higher birth rates, while the willingness to fight was more pronounced in Ukraine.\[628]

Several sources have pointed out that the war is considerably worsening Ukraine’s demographic crisis, making significant shrinking very likely.\[629] A July 2023 study by the Vienna Institute for International Economic Studies stated that,\[630]

> regardless of how long the war lasts and whether or not there is further military escalation, Ukraine is unlikely to recover demographically from the consequences of the war. Even in 2040 it will have only about 35 million inhabitants, around 20 % fewer than before the war (2021: 42.8 million) and the decline in the working-age population is likely to be the most severe and far-reaching.

The study took different scenarios, from a “best case” (end of the war in 2023 without much further escalation) to a “worst case” (end of the war in 2025 with further escalation) into account. Flight from war affected especially the southern and eastern regions and especially educated women of child-bearing age and their children. With an estimate of more than 20 % of refugees not returning, study author Maryna Tverdostup concluded that long-term shrinking will significantly impair the conditions for reconstruction.\[630]

Civilians from occupied Crimea drafted into the Russian army during the 2022 Russian mobilization

The war in Ukraine and the associated emigration, lower birth rates and war-related casualties further deepened the demographic crisis of Russia.\[631] Many commentators predict that the situation will be worse than during the 1990s.\[632] The UN is projecting that the decline that started in 2021 will continue, and if current demographic conditions persist, Russia’s population would be 120 million in fifty years, a decline of about 17 %.\[633]\[634]

Since February 2022, hundreds of thousands of Russians have emigrated; estimates range from 370,000 to over 820,000. Combined with mobilisation, this possibly removed roughly half a million to one million working-age males from Russia’s population.\[635] Studies report that this will have a demographic effect, especially in Russia, that lasts much longer than the conflict, and Putin’s time in office.\[636]

According to BBC:\[637]

> They come from different walks of life. Some are journalists like us, but there are also IT experts, designers, artists, academics, lawyers, doctors, PR specialists, and linguists. Most are under 50. Many share western liberal values and hope Russia will be a democratic country one day. Some are LGBTQ+. Sociologists studying the current Russian emigration say there is evidence that those leaving are younger, better educated and wealthier than those staying. More often they are from bigger cities.

According to Johannes Wachs, “The exodus of skilled human capital, sometimes called brain drain, out of Russia may have a significant effect on the course of the war and the Russian economy in the long run.”\[638] According to a survey, around 15 percent of those who left returned to Russia, either permanently or to settle their affairs.\[639]

In November 2023, at the World Russian People’s Council, Putin urged Russian women to have eight or more children amid increasing Russian casualties in the invasion.\[640]

In July 2024, Chief of the General Staff of the British Army Roland Walker said that with the current way of fighting, it would take Russia five years to control the four oblasts of Donetsk, Luhansk, Kherson and Zaporizhzhia that Russia claims as its own, and it would cost Russia from 1.5 to 1.8 million casualties.\[641] He said there are “no winners” in Russia’s invasion, adding “it is an utter devastation for both sides and lost generations.”\[642]

**Environmental impact**

*Main article: Environmental impact of the Russian invasion of Ukraine*

An explosion due to the shelling of a tank of nitric acid during the battle of Sievierodonetsk, 31 May 2022

Based on a preliminary assessment, the war has inflicted US \$51 billion in environmental damage in Ukraine; according to a report by the Yale School of the Environment, some 623,000 tonnes (1.4 billion pounds) of petrochemicals have burned as a result of shelling, while nearly 1,500 tonnes (3.2 million pounds) of pollutants have leaked into bodies of water. Hazardous chemicals have contaminated around 28 hectares (70 acres) of soil, and likely made agricultural activities temporarily impossible.\[643] Around 30 % of Ukraine’s land is now littered with explosives and more than 2.4 million hectares (5.9 million acres) of forest have been damaged.\[644]

According to Netherlands-based peace organisation PAX, Russia’s “deliberate targeting of industrial and energy infrastructure” has caused “severe” pollution, and the use of explosive weapons has left “millions of tonnes” of contaminated debris in cities and towns.\[645] In early June 2023, the Kakhovka Dam, under Russian occupation, was damaged, causing flooding and triggering warnings of an “ecological disaster”.\[646]

The Ukrainian government, international observers and journalists have described the damage as ecocide.\[647] The Ukrainian government is investigating more crimes against the environment and ecocide (a crime in Ukraine).\[648] Zelenskyy has met with prominent European figures (Heidi Hautala, Margot Wallstrom, Mary Robinson and Greta Thunberg) to discuss the environmental damage and how to prosecute it.\[649]

According to an investigation by NGL Media published in April 2024, Russia has completely destroyed over 60,000 hectares (150,000 acres) of Ukrainian forests. The investigation stated that long-term ecological consequences may include lowering of the groundwater level, reduction of biodiversity, worsening of air quality, fire outbreaks, and rivers and ponds drying up.\[650]

The war in Ukraine has severely disrupted climate policy all over the world and increased CO₂ emissions.\[651]\[652] The effects have been strongly felt in Asia,\[653]\[654]\[655] Europe,\[656] and the US.\[657] Fatih Birol, the head of the International Energy Agency talking about the prospects of COP 28 noted:\[658]

> ... the geopolitical situation, with many nations at loggerheads over the war in Ukraine, and still frosty relations between the US and China, would make for a difficult summit. \[...] The most important challenge \[to limiting temperature rises to 1.5 °C (2.7 °F) above pre-industrial levels] is the lack of international cooperation.

**Nuclear risk**

*Main article: Nuclear risk during the Russian invasion of Ukraine*

IAEA inspectors recording damage at Zaporizhzhia NPP

Throughout the war, Putin implied that Russia may use nuclear weapons if certain “red lines” were to be crossed. By 2024, most of the Russian government’s “red lines” had been crossed without nuclear weapons being used in response.\[659]

Four days into the invasion, Putin put Russia’s nuclear forces on high alert, raising fears that Russia could use tactical nuclear weapons against Ukraine.\[660] In response to what he called “completely irresponsible actions”, Zelenskyy suggested that there should be “global control” of Russia’s nuclear assets.\[661] In March 2023, Putin announced plans to install Russian tactical nuclear weapons in Belarus.\[662]

The invasion had an impact on Ukraine’s nuclear power plants. Russian forces captured Chernobyl on the first day, leading to a huge spike in radiation levels.\[663] Russia also captured Zaporizhzhia Nuclear Power Plant, the largest in Europe, and which has since been at risk and damaged by shelling. In August 2022, Zelenskyy described the situation as “Russian nuclear terror”.\[664] The International Atomic Energy Agency said it was the first time a military conflict occurred amid nuclear plants, and it called for a demilitarised zone around Zaporizhzhia NPP.\[665]

**Economic impact**

*Main article: Economic impact of the Russian invasion of Ukraine*

**Ukraine**

Ukrainian Minister of Economic Development and Trade Yulia Svyrydenko announced that for 2022 Ukraine had a 30 % loss in their gross domestic product (GDP).\[666] The International Monetary Fund predicted that Ukraine’s GDP would suffer a decrease from a minimum of 10 % to a maximum of 35 %;\[667] the European Bank for Reconstruction and Development also predicted that the invasion would cause a 20 % decrease of Ukraine’s GDP.\[668] The Ukrainian statistics service said that the GDP of Ukraine in 2023 grew by 5.3 %.\[669]

Ukraine began issuing war bonds on 1 March 2022, and the following day the Ukrainian government announced that they had raised 6.14 billion hryvnias.\[670] A ban was placed in May 2022 by the European Commission on grain sales in the countries of: Bulgaria, Poland, Hungary, Romania and Slovakia with the only exception being if they were transiting through those countries with the ban being lifted in September 2023.\[671]

The war has caused a major humanitarian crisis in Ukraine: the United Nations Development Programme calculated in March 2022 that a prolonged conflict would cause 30 % of the Ukrainian population to fall below the poverty line, while a further 62 % would be at risk of also falling into poverty within a year.\[672]

**Russia**

The Russian economic ministry said that for 2022 the GDP contracted by 2.1 %\[673] and for 2023 Russia’s government said the GDP grew by 3.6 %.\[674]

A price cap was placed on Russian oil by the Group of 7 (G7) at \$60 on 5 December 2022.\[675] The United States banned all imports of Russian oil on 8 March 2022.\[676] The European Union placed an embargo on oil products from Russia on 5 February 2023.\[675] Other countries that embargoed Russian oil included Five Eyes partners Canada, the United Kingdom, Australia and New Zealand.\[677] Russia itself issued a ban on foreign diesel sales starting on 21 September 2023, before being lifted on 6 October.\[678]

On 27 April 2024, it was reported that Russia was planning increases in personal income taxes and corporate taxes to help pay for the war.\[679]

In January 2025, it was reported that, since early 2022, Russia had used a two-prong strategy to finance the extremely large costs of the war. In addition to the official Russian government defense budget—direct financial expenditure for waging the war in Ukraine was estimated at US \$250 billion through June 2024 for military spending through normal channels,\[23] with the military budget rising to over 20 % of annual GDP—an additional off-budget financing mechanism was employed to fund the war with over US \$200 billion of debt funding obtained from preferential bank loans made to defence contractors and war-related businesses, loans that had been compelled by the Russian government.\[24]\[25]

**Peace efforts**

*Main article: Peace negotiations in the Russian invasion of Ukraine*

Attendees at the June 2024 Ukraine peace summit

Peace negotiations between Russia and Ukraine took place on 28 February, 3 March, and 7 March 2022, on the Belarus–Ukraine border, with further talks held on 10 March in Turkey and a fourth round of negotiations beginning 14 March.\[680] The talks ended without agreement.

*Putin made recognition of Russian sovereignty over the annexed territories (pictured) a condition for peace talks with Ukraine.*\[681]

In 2024, Ukraine’s main peace terms were that Russia withdraw its troops, that Ukrainian prisoners be released, Russian leaders be prosecuted for war crimes, and Ukraine be given security guarantees to prevent further aggression. Russia’s main terms were that Russia must keep all the land it occupied, that it be given all of the provinces that it claims but does not fully control, that Ukraine end plans to join NATO, and sanctions against Russia be lifted.\[682] According to Western sources, allowing Russia to keep the land it seized would “reward the aggressor while punishing the victim” and set a dangerous precedent.\[683] They predicted this would allow Russia to re-arm and encourage it “to continue its imperialist campaign of expansionism” against Ukraine and other neighbors, and embolden other expansionist regimes.\[683]\[684]\[685]\[686]

After Donald Trump became US president in 2025, there was a major shift in US policy. The Trump administration began negotiations with Russia and separately with Ukraine.

*Further information: Peace negotiations in the Russian invasion of Ukraine § 2025 developments*

**International reactions**

*Main article: Reactions to the Russian invasion of Ukraine*
See also: Protests against the Russian invasion of Ukraine

UN General Assembly Resolution ES-11/1 vote on 2 March 2022 condemning the invasion of Ukraine and demanding a complete withdrawal of Russian troops
In favour
Against
Abstained
Absent
Non-member

The invasion received widespread international condemnation from governments and intergovernmental organisations.\[687] On 2 March 2022 and on 23 February 2023, 141 member states of the UN General Assembly voted for a resolution saying that Russia should immediately withdraw. Seven, including Russia, voted against the measure.\[688] Political reactions to the invasion included new sanctions imposed on Russia, which triggered widespread economic effects on the Russian and world economies.\[689] Sanctions forced Russia to reorient its oil exports to non-sanctioning countries such as India, rely more on LNG (which was not subject to European Union sanctions), and shift its coal exports from Europe to Asia.\[690] Most European countries cancelled nuclear cooperation with Russia.\[691]

Over 70 sovereign states and the European Union delivered humanitarian aid to Ukraine, and nearly 50 countries plus the EU provided military aid.\[692] Economic sanctions included a ban on Russian aircraft using EU airspace,\[693] a ban of certain Russian banks from the SWIFT international payments system, and a ban on certain Russian media outlets.\[694] Reactions to the invasion have included public response, media responses, peace efforts, and the examination of the legal implications of the invasion.

Some countries, particularly in the Global South, saw public sympathy or outright support for Russia, due in part to distrust of US foreign policy.\[695] Protests and demonstrations were held worldwide, including some in Russia and parts of Ukraine occupied by Russia.\[696] Calls for a boycott of Russian goods spread on social media platforms,\[697] while hackers attacked Russian websites, particularly those operated by the Russian government.\[698] Anti-Russian sentiment against Russians living abroad surged after the invasion.\[699] In March 2022, Russian President Putin introduced prison sentences of up to 15 years for publishing “fake news” about Russian military operations,\[700] intended to suppress any criticism related to the war.\[701]

According to the Economist Intelligence Unit in 2023, 31 percent of the world’s population live in countries that are leaning towards or supportive of Russia, 30.7 percent live in neutral countries, and 36.2 percent live in countries that are against Russia in some way.\[702]

A number of supranational and national parliaments passed resolutions declaring Russia to be a state sponsor of terrorism.\[703] By October 2022, three countries—Latvia, Lithuania and Estonia—had declared Russia a terrorist state.\[704] On 1 August 2023, Iceland became the first European country to close its embassy in Russia as a result of the invasion of Ukraine.\[705]

The invasion prompted Ukraine,\[706] Finland and Sweden to officially apply for NATO membership.\[707] Finland became a member of NATO on 4 April 2023,\[708] followed by Sweden on 7 March 2024.\[709]

A documentary film produced during the siege of Mariupol, *20 Days in Mariupol*, won the Oscar for best documentary in 2024.\[710]
",russia-ukraine-invasion,wikipedia.txt
"Russia’s war in Ukraine, explained",Jen Kirby and Jonathan Guyer,https://www.vox.com/2022/2/23/22948534/russia-ukraine-war-putin-explosions-invasion-explained,"Mar 6, 2022","Russia is bombarding major cities in Ukraine, more than a week into a war where Moscow has faced setbacks on the battlefield — yet seems undeterred from its campaign to take Ukraine.

Get in-depth coverage about Russia’s war on Ukraine.

Why Ukraine?

Learn the history behind the conflict and what Russian President Vladimir Putin has said about his war aims.

The stakes of Putin’s war

Russia’s invasion has the potential to set up a clash of nuclear world powers. It’s destabilizing the region and terrorizing Ukrainian citizens. It could also impact inflation, gas prices, and the global economy.

How other countries are responding

The US and its European allies have responded to Putin’s aggression with unprecedented sanctions, but have no plans to send troops to Ukraine, for good reason.

How to help

Where to donate if you want to assist refugees and people in Ukraine.

On March 4, Russia seized Zaporizhzhia, one of Europe’s largest nuclear power plants. Russian shelling of the southeastern Ukraine facility set off a fire, which Ukrainian officials warned could set off a nuclear disaster. It took hours, but the fire was extinguished, and international monitors said that they do not detect elevated radiation levels and that the fire did not damage “essential” equipment. US officials have said Russia now appears to be in control of the plant.

But the incident was a reminder of how dangerous this war in Ukraine is becoming, and how uncertain and confusing things still are on the ground. Russian troops were advancing toward Kyiv, and thousands and thousands are fleeing in advance of a possible siege on the city.

The Russian military has made advances in the south, and are gaining in the area of Kherson, a port city on the Black Sea whose control is reportedly contested, and Mariupol, on the Sea of Azov. Russian bombardment of these cities has resulted in humanitarian issues, with bridges and roads damaged by the fighting and dwindling access to food, clean water, medicine, and electricity in certain areas. Kharkiv, Ukraine’s second-largest city, experienced heavy Russian fire this week, and strikes have heavily damaged residential areas.

Ukrainian and Russian officials met in early March, and tentatively agreed on the need for humanitarian corridors — basically, safe zones for civilians to flee and supplies to pass through — but did not reach agreements on a larger ceasefire. As of March 6, multiple attempts to evacuate Ukrainian civilians have been halted because of Russian shelling.

Putin’s attempt to redraw the map of Europe risks becoming the most devastating conflict on the continent since World War II. Already, it is causing an astounding humanitarian crisis: Hundreds, perhaps thousands, of civilians have died, and more than 1.5 million people have fled the violence so far, according to the United Nations High Commissioner for Refugees, making it the fastest-growing refugee crisis in Europe since World War II.

The battle for Ukraine began in the early morning hours, local time, on February 24, when Russian President Vladimir Putin launched what he called a “special military operation” into the country of about 40 million. He claimed the Russian military seeks “demilitarization and denazification” but not occupation; attacks shortly followed from multiple fronts and targeted toward multiple cities.",russia-ukraine-invasion,vox.txt
"After 3 months, Russia still bogged down in Ukraine war",THE ASSOCIATED PRESS,https://apnews.com/article/russia-ukraine-putin-kyiv-politics-9e0c72aa16d97d7466f22dfbf6dc8fa0,"May 24, 2022","When Russia invaded Ukraine on Feb. 24, it had hoped to overtake the country in a blitz lasting only days or a few weeks. Many Western analysts thought so, too.

As the conflict marked its third month Tuesday, however, Moscow appears to be bogged down in what increasingly looks like a war of attrition, with no end in sight and few successes on the battlefield.

There was no quick victory for Russian President Vladimir Putin’s powerful forces, no rout that would allow the Kremlin to control most of Ukraine and establish a puppet government.

Instead, Russian troops got bogged down on the outskirts of Kyiv and other big cities amid stiff Ukrainian defenses. Convoys of Russian armor seemed stalled on long stretches of highway. Troops ran out of supplies and gasoline, becoming easy targets.

A little over a month into the invasion, Russia effectively acknowledged the failure of its blitz and pulled troops back from areas near Kyiv, declaring a shift of focus to the eastern industrial region of the Donbas, where Moscow-backed separatists have been fighting Ukrainian forces since 2014.

To be sure, Russia has seized significant chunks of territory around the Crimean Peninsula that Moscow annexed eight years ago. It also has managed to cut Ukraine off completely from the Sea of Azov, finally securing full control over the key port of Mariupol after a siege that prevented some of its troops from fighting elsewhere while they battled diehard Ukrainian forces.

But the offensive in the east seems to have bogged down as well, as Western arms flow into Ukraine to bolster its outgunned army.

Russian artillery and warplanes relentlessly pound Ukrainian positions, trying to break through defenses built up during the separatist conflict. They have made only incremental gains, clearly reflecting both Russia’s insufficient troop numbers and the Ukrainian resistance. Russia recently lost hundreds of personnel and dozens of combat vehicles while trying to cross a river to build a bridgehead.

“The Russians are still well behind where we believe they wanted to be when they started this revitalized effort in the eastern part of the country,” Pentagon press secretary John Kirby said Friday, adding that small towns and villages were changing hands every day in the Donbas.

Elsewhere in Ukraine, Russian forces have methodically targeted Western weapons shipments, ammunition and fuel depots, and critical infrastructure in hopes of weakening Kyiv’s military and economy.

But in trying to gain ground, Russian forces have also relentlessly shelled cities and laid siege to some of them. In the latest example of the war’s toll, 200 bodies were found in a collapsed building in Mariupol, Ukrainian authorities said Tuesday.

The Kremlin appears to still harbor a more ambitious goal of cutting off Ukraine from the Black Sea coast all the way to the Romanian border, a move that would also give Moscow a land corridor to Moldova’s separatist region of Transnistria, where Russian troops are stationed.

But Russia seems to know that this objective is not currently achievable with the limited forces it has.

“I think they’re just increasingly realizing that they can’t necessarily do all of it, certainly not at one go,” said Justin Crump, a former British tank commander who heads Sibylline, a strategic advisory firm.

Moscow’s losses have forced it to rely increasingly on hastily patched-together units in the Donbas that could only make small gains, he said.

“It’s a constant downshifting of gear toward smaller objectives that Russia can actually achieve,” Crump said. “And I think on the biggest scale, they’ve actually downsized their strategy better to match their their ability on the ground.”

